project_id,title,description,skills,domain,difficulty,tags
1,Smart Attendance System,Build a face recognition attendance system using OpenCV and deep learning,python opencv deep-learning machine-learning,AI/ML,Intermediate,"face-recognition,automation,computer-vision"
2,E-Commerce Website,Develop a full-stack e-commerce platform with cart and payment integration,html css javascript nodejs mongodb,Web Development,Intermediate,"fullstack,shopping,payment-gateway"
3,Stock Price Predictor,Predict stock prices using LSTM neural networks and financial data,python tensorflow pandas numpy,Data Science,Advanced,"finance,neural-networks,time-series"
4,Chat Application,Real-time chat app with WebSockets rooms and notifications,javascript nodejs socket.io react,Web Development,Beginner,"real-time,messaging,websockets"
5,Plant Disease Detection,Detect plant diseases from leaf images using CNN,python keras tensorflow image-processing,AI/ML,Advanced,"agriculture,cnn,image-classification"
6,Budget Tracker App,Personal finance manager with charts and expense categorization,html css javascript react,Web Development,Beginner,"finance,dashboard,visualization"
7,Sentiment Analysis Tool,Analyze sentiment of tweets and reviews using NLP,python nltk scikit-learn pandas,Data Science,Intermediate,"nlp,text-analysis,social-media"
8,IoT Home Automation,Control home devices via mobile app using Raspberry Pi and MQTT,python iot raspberry-pi mqtt,IoT,Advanced,"smart-home,embedded,networking"
9,Resume Parser,Extract and structure information from resumes using NLP,python spacy nltk flask,AI/ML,Intermediate,"nlp,parsing,automation"
10,Weather Dashboard,Visualize weather data with interactive charts using API integration,html css javascript d3js,Web Development,Beginner,"api,visualization,charts"
11,Fraud Detection System,Detect fraudulent transactions using machine learning algorithms,python scikit-learn pandas numpy,Data Science,Advanced,"security,classification,banking"
12,AR Navigation App,Augmented reality indoor navigation using smartphone sensors,java android opencv,Mobile,Advanced,"ar,navigation,mobile"
13,Blockchain Voting System,Secure electronic voting using blockchain technology,python solidity blockchain,Blockchain,Advanced,"security,decentralized,smart-contracts"
14,Music Recommendation Engine,Recommend songs based on listening history using collaborative filtering,python pandas scikit-learn,AI/ML,Intermediate,"recommendation,music,machine-learning"
15,URL Shortener,Build a scalable URL shortener with analytics and QR codes,python flask mysql redis,Web Development,Beginner,"backend,api,database"
16,Pose Estimation Fitness App,Track workout poses and count reps using MediaPipe,python mediapipe opencv,AI/ML,Intermediate,"fitness,pose-estimation,real-time"
17,SQL Query Optimizer,Analyze and suggest optimizations for SQL queries using AI,python nlp sql machine-learning,Data Science,Advanced,"database,optimization,nlp"
18,News Aggregator Bot,Scrape and summarize news articles by category,python scrapy nltk flask,Web Development,Beginner,"web-scraping,nlp,automation"
19,3D Model Viewer,Interactive 3D model viewer in browser using WebGL,javascript webgl threejs,Web Development,Intermediate,"3d,graphics,interactive"
20,Crop Yield Prediction,Predict agricultural crop yields using weather and soil data,python scikit-learn pandas matplotlib,Data Science,Intermediate,"agriculture,regression,prediction"
21,Flutter Weather App,Build a cross-platform weather application using Flutter and Dart with real-time API integration and beautiful UI,flutter dart api-integration mobile-development,Mobile,Beginner,"flutter,weather,cross-platform"
22,Network Intrusion Detection System,Detect suspicious network activities using packet analysis and anomaly detection,python scapy machine-learning networking,Cybersecurity,Advanced,"security,network-monitoring,intrusion-detection"
23,Password Strength Analyzer,Analyze and rate password strength with entropy and dictionary attack simulation,python cryptography security,Cybersecurity,Beginner,"password,security,authentication"
24,Containerized Microservices Platform,Deploy and manage microservices using Docker and Kubernetes,docker kubernetes microservices devops,DevOps,Advanced,"containers,orchestration,cloud"
25,CI/CD Pipeline Automation,Build an automated CI/CD pipeline for testing and deployment using Jenkins and GitHub Actions,jenkins github-actions docker,DevOps,Intermediate,"automation,continuous-integration,devops"
26,Cloud File Backup System,Create a system that automatically backs up files to cloud storage,python aws-s3 cloud-computing,Cloud Computing,Intermediate,"backup,cloud,storage"
27,Server Monitoring Dashboard,"Monitor server performance metrics like CPU, memory and uptime",grafana prometheus linux,Cloud Computing,Intermediate,"monitoring,server,analytics"
28,2D Platformer Game,Develop a 2D side-scrolling platformer game with physics and levels,unity csharp game-development,Game Development,Beginner,"gaming,physics,platformer"
29,Chess Game with AI Opponent,Build a chess game with a minimax AI opponent,python pygame ai-algorithms,Game Development,Intermediate,"chess,ai,game-logic"
30,Ray Tracing Renderer,Implement a simple ray tracing engine to render 3D scenes,c++ computer-graphics rendering,Computer Graphics,Advanced,"raytracing,graphics,3d"
31,Procedural Terrain Generator,Generate realistic terrains using Perlin noise algorithms,python opengl graphics,Computer Graphics,Intermediate,"terrain,procedural,visualization"
32,Peer-to-Peer File Transfer Tool,Transfer files directly between devices using sockets,python socket-programming networking,Networking,Intermediate,"p2p,networking,file-transfer"
33,Chat Server with Protocol Design,Design a custom communication protocol for a multi-client chat server,java tcp-ip sockets,Networking,Advanced,"protocol,networking,communication"
34,Smart Traffic Light Controller,Control traffic signals dynamically based on vehicle density,arduino sensors embedded-c,Embedded Systems,Intermediate,"traffic,automation,sensors"
35,Digital Thermostat System,Build a programmable thermostat using microcontrollers and sensors,arduino c embedded-systems,Embedded Systems,Beginner,"temperature,automation,embedded"
36,Line Following Robot,Design a robot that follows a line using IR sensors and microcontroller control,arduino robotics sensors,Robotics,Beginner,"robotics,automation,embedded"
37,Obstacle Avoiding Robot,Build an autonomous robot that detects and avoids obstacles,arduino ultrasonic-sensor robotics,Robotics,Intermediate,"robot,automation,sensors"
38,Big Data Log Analyzer,Analyze large-scale server logs using distributed computing tools,apache-spark hadoop python,Big Data,Advanced,"big-data,analytics,logs"
39,Real-Time Data Streaming Dashboard,Process and visualize live streaming data using Kafka and Spark,kafka spark streaming big-data,Big Data,Advanced,"streaming,data-processing,analytics"
40,Distributed File System Simulator,Simulate a distributed file system architecture similar to HDFS,java distributed-systems networking,Systems,Advanced,"distributed-systems,storage,architecture"
